{
  "schemaVersion": "ClaimBindingV1",
  "stampId": "ES-R24-WP-701-PARSER-QUARANTINE-CLAIM-BINDINGS",
  "contourId": "WP-701_PARSER_QUARANTINE",
  "evidenceClass": "CONTRACT",
  "verdict": "PASS",
  "headSha": "68bfe2062ccb263fa3d1603c8e228508c547957b",
  "originMainSha": "68bfe2062ccb263fa3d1603c8e228508c547957b",
  "generatedAtUtc": "2026-09-02T14:23:51Z",
  "oracle": "WP701 exact local worktree-byte binding at admitted base; candidate protected merge postmerge final protected-WIP snapshot and external terminal provider identities remain explicit unclaimed external predicates",
  "claimBindings": [
    {"filePath": "docs/OPS/R24/CORRECTIVE/WP701_MAIN_PRODUCT_SELECTION_RECEIPT_V1.json", "sha256": "4e04ae5c32775a1f92c7d3aa522979fb27f66cc0c157ce5875a7301fae4a41c3", "claimTerms": ["READY"]},
    {"filePath": "docs/OPS/R24/CORRECTIVE/WP701_MAIN_PRODUCT_OWNER_AUTHORITY_V1.json", "sha256": "9334bf7b5cc9a17fe6daa96147595510b270748725d1a128069c7acd1e0de95b", "claimTerms": ["READY"]},
    {"filePath": "docs/OPS/R24/CORRECTIVE/WP701_MAIN_PRODUCT_STAGE_INSTANCE_V1.json", "sha256": "61b28fed30b12a8e1a994c1c4290bc40fc805cd0dafd10274d25ce98ab7a890f", "claimTerms": ["READY"]},
    {"filePath": "docs/OPS/R24/CORRECTIVE/WP701_MAIN_PRODUCT_STAGE_ADMISSION_ATTESTATION_V1.json", "sha256": "1e766ec3f88f74046442146bb866f1395831c0fbd01362135b3d863c160edca8", "claimTerms": ["PASS"]},
    {"filePath": "docs/OPS/R24/CORRECTIVE/WP701_PROTECTED_WIP_BEFORE_V1.json", "sha256": "1f412eea6efcbd6ea4dafbbfee6769740e775cdaab4cbb08a82b3ef3498bbdad", "claimTerms": ["PASS"]},
    {"filePath": "docs/OPS/R24/CORRECTIVE/WP701_CARRIER_REGISTRY_V1.json", "sha256": "2bf94454f1a37a9c86c863bbd715d9a84617ff0386c20c6fbbfc3c78622aef33", "claimTerms": ["COMPLETE"]},
    {"filePath": "docs/OPS/R24/CORRECTIVE/WP701_ACCEPTANCE_MATRIX_V1.json", "sha256": "38ae631afd6a4fd06bd594842d86b34169fb4792a34640325dec800d9ed32497", "claimTerms": ["PASS"]},
    {"filePath": "docs/OPS/R24/CORRECTIVE/WP701_EFFECTIVE_STATE_V1.json", "sha256": "205ecd6b98d31454c8e31dc9787bf2c5d30994d6af21c6abf21bedaf453e4f02", "claimTerms": ["SAFE"]},
    {"filePath": "docs/OPS/R24/CORRECTIVE/WP701_STAGE_REGISTRY_V1.json", "sha256": "2e652f4c4d2e8d1124472aa43c5dbdb1927e064c96e997a5c88e22928a9cc8f7", "claimTerms": ["READY"]},
    {"filePath": "docs/OPS/R24/CORRECTIVE/WP701_LEASE_RELEASE_V1.json", "sha256": "1550cd977490f267b4193264a186a30a52719e014629328ae5b6fbf3e91a88a6", "claimTerms": ["SAFE"]},
    {"filePath": "docs/OPS/R24/CORRECTIVE/WP701_TERMINAL_RECEIPT_V1.json", "sha256": "2d1d4e483f1ca35a4724a290b8ee612b7b5fee36c630f7ecdd8da69cc3f36045", "claimTerms": ["SAFE"]},
    {"filePath": "docs/OPS/R24/CORRECTIVE/WP701_TERMINAL_SUPPLEMENT_V1.json", "sha256": "884eab908a6cc638da669c8aa3c4eaec1ba382b2cf74d5ae9d90cdfa3683f2a5", "claimTerms": ["PASS"]}
  ],
  "implementationArtifactDigests": [
    {"path": "src/core/parser-quarantine-v1.mjs", "sha256": "d8e431f17009a23e4e8908817bdf39b7d286b0397152cc2786f2c8939accbc79", "terms": ["PURE_LOCAL", "ARCHIVE_XML_OOXML_CONTAINMENT", "NO_AUTHORITY_EFFECTS"]},
    {"path": "test/fixtures/r24-wp701-parser-quarantine-fixtures.js", "sha256": "8232f2f9ed58c4a6194ef59a689c2313685cbca24dd42c38dd667feb3f20f466", "terms": ["DETERMINISTIC_HOSTILE_CORPUS"]},
    {"path": "test/unit/r24-wp701-parser-quarantine.test.js", "sha256": "1f3dfd38622330b9a1ab2693baa5d55ebc418683d8b6ae5c2e2f19f6bcf41e20", "terms": ["CONTRACT_NEGATIVE_UNIT"]},
    {"path": "test/unit/r24-wp701-parser-quarantine-integration.test.js", "sha256": "c61c1318ce004ad6493f5bba257a14527e2ce226c11644e70e280a12e003fc4b", "terms": ["WP700_IR_PHYSICAL_ROUNDTRIP_PRIVACY"]},
    {"path": "test/unit/r24-wp701-parser-quarantine-mutants.test.js", "sha256": "69cc4806896352d704f12781df4f561c14a2dbe26152c9bbab57da2794e34289", "terms": ["FORTY_FOUR_HOSTILE_MUTANTS"]},
    {"path": "test/contracts/r24-wp701-post-audit-compatibility.contract.test.mjs", "sha256": "dcd2337821b4d50801d6194b3fa4c71f8064074b648c0cd3f71499611c0747e6", "terms": ["EXACT_ADMISSION_CHAIN_HOSTILE"]},
    {"path": "test/contracts/r24-wp701-terminal-carriers.contract.test.mjs", "sha256": "4fc0fcd26ded239a3d5588929983fdab89dc80253759f8abf5a74c9240572f20", "terms": ["TERMINAL_CARRIER_HOSTILE"]},
    {"path": "scripts/ops/r24/corrective/post-audit-certification-set.mjs", "sha256": "81ed8ae0efa0724fa018d68729bd91a8cdca9f1a0e3a190f1ffced3dc2445d40", "terms": ["WP701_POST_EVALUATION_EXACT_DELTA"]}
  ],
  "executedEvidence": [
    {"command": "WP701 focused unit integration and mutant tests", "verdict": "PASS", "tests": {"pass": 20, "fail": 0}, "mutants": {"killed": 44, "survived": 0}},
    {"command": "WP701 post-audit and terminal hostile contracts", "verdict": "PASS", "tests": {"pass": 8, "fail": 0}},
    {"command": "pinned StageAdmissionVerifier V2 exact-base replay before mutation", "verdict": "PASS", "tests": {"pass": 1, "fail": 0}}
  ],
  "nonClaims": [
    "NO_FUTURE_EXTERNAL_PROVIDER_IDENTITY_PRECLAIMED",
    "NO_SIGNING_NOTARIZATION_PUBLIC_DISTRIBUTION_PRODUCTION_RELEASE_PAYMENTS_SECRETS_USER_DOCUMENT_MUTATION_OR_UNADMITTED_NETWORK_EXTERNAL_PROVIDER_EFFECT",
    "NO_PRODUCT_MUTATION_COMMAND_PERSISTENCE_RENDERER_OR_RUNTIME_WIRING",
    "NO_WP701_GRAPH_COMPLETION_BEFORE_EXTERNAL_TERMINAL_PROOF",
    "PROGRAM_DONE_FALSE"
  ]
}
