{
  "schemaVersion": "ClaimBindingV1",
  "stampId": "ES-R24-WP-103-REVISION-PRODUCT-ORDER-CLAIM-BINDINGS",
  "contourId": "WP-103_REVISION_PRODUCT_ORDER",
  "evidenceClass": "CONTRACT",
  "verdict": "PASS",
  "headSha": "ea171d7b36efcae8e4c1d51028f14cbf51a7720f",
  "originMainSha": "4d957820f61d4a35ad293f90865182ff2261f499",
  "generatedAtUtc": "2026-08-24T00:57:00Z",
  "oracle": "strict ClaimBindingV1 exact-hash binding for WP-103 replayable PlanState closure and source receipt",
  "claimBindings": [
    {
      "filePath": "docs/OPS/R24/PLAN_STATE_R24.json",
      "sha256": "d83c2da8e38b550d853b697a3970b94958409897743d4c688ba29bc7dad885a8",
      "claimTerms": [
        "DONE"
      ]
    },
    {
      "filePath": "docs/OPS/R24/PLAN_STATE_SOURCE_RECEIPT_R24.json",
      "sha256": "0ad4a35662197c4a5c96381bb8d55bf9181a2ea3722292522b0a6e3dae5f6971",
      "claimTerms": [
        "DONE"
      ]
    }
  ],
  "implementationArtifactDigests": [
    {
      "path": "src/core/revision-algebra-v1.cjs",
      "sha256": "76768c50ff2d3f9103d80195e28c97671ea0b1e3171d85c5320dfa7912ce0923",
      "terms": [
        "revision product order",
        "canonical serialization"
      ]
    }
  ],
  "executedEvidence": [
    {
      "command": "npm run -s test:r24-wp103",
      "verdict": "PASS",
      "tests": {
        "pass": 12,
        "fail": 0
      },
      "mutants": {
        "killed": 5,
        "survived": 0
      }
    }
  ],
  "nonClaims": [
    "This binding resolves only WP-103 PlanState and source-receipt DONE vocabulary.",
    "It does not mark WP-104 or the full 109-node R2.4 program DONE.",
    "It does not mutate product runtime, reopen parked V2, or claim physical qualification or release readiness."
  ]
}
