{
  "schemaVersion": "ClaimBindingV1",
  "stampId": "ES-R24-WP-101-IPC-ADMISSION-CLAIM-BINDINGS",
  "contourId": "WP-101_IPC_ADMISSION",
  "evidenceClass": "CONTRACT",
  "verdict": "PASS",
  "headSha": "ea171d7b36efcae8e4c1d51028f14cbf51a7720f",
  "originMainSha": "4d957820f61d4a35ad293f90865182ff2261f499",
  "generatedAtUtc": "2026-08-24T00:57:00Z",
  "oracle": "docs-claim-lint exact sha-bound mutable PlanState claim binding for WP-101_IPC_ADMISSION and subsequent repo-local closure state through WP-102",
  "claimBindings": [
    {
      "filePath": "docs/OPS/R24/PLAN_STATE_R24.json",
      "sha256": "ba6c5b0a8898bd9b4bb39cd003430e5b332b6317069971f4f263d538ff4d22d5",
      "claimTerms": [
        "DONE"
      ]
    },
    {
      "filePath": "docs/OPS/R24/PLAN_STATE_SOURCE_RECEIPT_R24.json",
      "sha256": "d8b62445ba733130712e16f50b1952270a9a418b77c97d73b949bd6595975fa2",
      "claimTerms": [
        "DONE"
      ]
    }
  ],
  "nonClaims": [
    "This linter-specific stamp resolves only current WP-101_IPC_ADMISSION PlanState claim vocabulary for docs-claim-lint.",
    "This stamp does not mark the full 109-node R2.4 program DONE.",
    "This stamp does not mutate product/runtime code, reopen parked V2, or claim release readiness.",
    "This stamp does not implement or certify later contour product code beyond separately stamped closure evidence."
  ]
}
